Sector,Sovereigns including central banks and multilateral development banks and local governments,Financials including government-backed financials,"Basic materials, energy, industrials, agriculture, manufacturing, mining and quarrying","Consumer goods and services, transportation and storage, administrative and support service activities","Technology, telecommunications","Health care, utilities, professional and technical activities",Other sector,Qualified IndicesSovereigns including central banks and multilateral development banks and local governments,100%,10%,20%,25%,20%,15%,0%,45%Financials including government-backed financials,10%,100%,5%,15%,20%,5%,0%,45%"Basic materials, energy, industrials, agriculture, manufacturing, mining and quarrying",20%,5%,100%,20%,25%,5%,0%,45%"Consumer goods and services, transportation and storage, administrative and support service activities",25%,15%,20%,100%,25%,5%,0%,45%"Technology, telecommunications",20%,20%,25%,25%,100%,5%,0%,45%"Health care, utilities, professional and technical activities",15%,5%,5%,5%,5%,100%,0%,45%Other sector,0%,0%,0%,0%,0%,0%,100%,0%Qualified Indices,45%,45%,45%,45%,45%,45%,0%,100%
